{
  "app": {
    "adapter": "react-mui",
    "appRoot": ".",
    "product": "Mini CRM"
  },
  "components": [
    {
      "confidence": "medium",
      "evidence": "INFERRED",
      "exportNames": [
        "App"
      ],
      "families": [],
      "file": "src/app.tsx",
      "id": "src/app.tsx#App",
      "importers": {
        "files": 0,
        "modules": []
      },
      "layer": "snowflake",
      "level": "organism",
      "levelReason": "wraps a molecule-level component; raised to organism by its children",
      "line": 5,
      "loc": 7,
      "logic": "presentational",
      "module": null,
      "name": "App",
      "promotionCandidate": false,
      "quality": {
        "rawValues": 0,
        "themeValues": 0
      },
      "shared": false,
      "signals": {
        "data": false,
        "dataHooks": [],
        "domainProps": false,
        "pageArea": false,
        "primaryActions": 0,
        "region": false,
        "slots": 0,
        "styledTarget": null
      },
      "smells": [],
      "uses": [
        "src/routes/Routes.tsx#AppRoutes"
      ],
      "wraps": [
        "mui:ThemeProvider"
      ]
    },
    {
      "confidence": "high",
      "evidence": "CONFIRMED",
      "exportNames": [
        "default"
      ],
      "families": [],
      "file": "src/common/components/page-title.tsx",
      "id": "src/common/components/page-title.tsx#PageTitle",
      "importers": {
        "files": 1,
        "modules": [
          "leads"
        ]
      },
      "layer": "core",
      "level": "atom",
      "levelReason": "wraps a single primitive",
      "line": 3,
      "loc": 3,
      "logic": "presentational",
      "module": "shared",
      "name": "PageTitle",
      "promotionCandidate": false,
      "quality": {
        "rawValues": 1,
        "themeValues": 1
      },
      "shared": true,
      "signals": {
        "data": false,
        "dataHooks": [],
        "domainProps": false,
        "pageArea": false,
        "primaryActions": 0,
        "region": false,
        "slots": 0,
        "styledTarget": null
      },
      "smells": [],
      "uses": [],
      "wraps": [
        "mui:Typography"
      ]
    },
    {
      "confidence": "high",
      "evidence": "CONFIRMED",
      "exportNames": [
        "PanelToolbar"
      ],
      "families": [],
      "file": "src/common/components/panel-toolbar.tsx",
      "id": "src/common/components/panel-toolbar.tsx#PanelToolbar",
      "importers": {
        "files": 1,
        "modules": [
          "leads"
        ]
      },
      "layer": "core",
      "level": "molecule",
      "levelReason": "2+ atoms combined for one job",
      "line": 6,
      "loc": 9,
      "logic": "presentational",
      "module": "shared",
      "name": "PanelToolbar",
      "promotionCandidate": false,
      "quality": {
        "rawValues": 0,
        "themeValues": 2
      },
      "shared": true,
      "signals": {
        "data": false,
        "dataHooks": [],
        "domainProps": false,
        "pageArea": false,
        "primaryActions": 1,
        "region": false,
        "slots": 0,
        "styledTarget": null
      },
      "smells": [],
      "uses": [],
      "wraps": [
        "icon:Close",
        "mui:Button",
        "mui:IconButton",
        "mui:Toolbar",
        "mui:Typography"
      ]
    },
    {
      "confidence": "high",
      "evidence": "CONFIRMED",
      "exportNames": [
        "StatusTag"
      ],
      "families": [],
      "file": "src/common/components/status-tag.tsx",
      "id": "src/common/components/status-tag.tsx#StatusTag",
      "importers": {
        "files": 1,
        "modules": [
          "leads"
        ]
      },
      "layer": "core",
      "level": "atom",
      "levelReason": "wraps a single primitive",
      "line": 5,
      "loc": 3,
      "logic": "presentational",
      "module": "shared",
      "name": "StatusTag",
      "promotionCandidate": false,
      "quality": {
        "rawValues": 2,
        "themeValues": 1
      },
      "shared": true,
      "signals": {
        "data": false,
        "dataHooks": [],
        "domainProps": false,
        "pageArea": false,
        "primaryActions": 0,
        "region": false,
        "slots": 0,
        "styledTarget": null
      },
      "smells": [],
      "uses": [],
      "wraps": [
        "mui:Chip"
      ]
    },
    {
      "confidence": "high",
      "evidence": "CONFIRMED",
      "exportNames": [
        "UnusedCard"
      ],
      "families": [
        "dead-shared:all"
      ],
      "file": "src/common/components/unused-card.tsx",
      "id": "src/common/components/unused-card.tsx#UnusedCard",
      "importers": {
        "files": 0,
        "modules": []
      },
      "layer": "core",
      "level": "atom",
      "levelReason": "wraps a single primitive",
      "line": 3,
      "loc": 7,
      "logic": "presentational",
      "module": "shared",
      "name": "UnusedCard",
      "promotionCandidate": false,
      "quality": {
        "rawValues": 0,
        "themeValues": 1
      },
      "shared": true,
      "signals": {
        "data": false,
        "dataHooks": [],
        "domainProps": false,
        "pageArea": false,
        "primaryActions": 0,
        "region": false,
        "slots": 0,
        "styledTarget": null
      },
      "smells": [],
      "uses": [],
      "wraps": [
        "mui:Card",
        "mui:CardContent",
        "mui:Typography"
      ]
    },
    {
      "confidence": "high",
      "evidence": "CONFIRMED",
      "exportNames": [
        "DealsPanel"
      ],
      "families": [
        "cross-feature-import:deals->settings",
        "repeated-style-block:e30c88a12898"
      ],
      "file": "src/components/deals/DealsPanel.tsx",
      "id": "src/components/deals/DealsPanel.tsx#DealsPanel",
      "importers": {
        "files": 0,
        "modules": []
      },
      "layer": "snowflake",
      "level": "organism",
      "levelReason": "renders a region (dialog, drawer, table, nav…)",
      "line": 6,
      "loc": 8,
      "logic": "presentational",
      "module": "deals",
      "name": "DealsPanel",
      "promotionCandidate": false,
      "quality": {
        "rawValues": 3,
        "themeValues": 2
      },
      "shared": false,
      "signals": {
        "data": false,
        "dataHooks": [],
        "domainProps": false,
        "pageArea": false,
        "primaryActions": 0,
        "region": true,
        "slots": 0,
        "styledTarget": null
      },
      "smells": [],
      "uses": [
        "src/components/settings/StatusChip.tsx#StatusChip"
      ],
      "wraps": [
        "mui:Drawer",
        "mui:Typography"
      ]
    },
    {
      "confidence": "high",
      "evidence": "CONFIRMED",
      "exportNames": [
        "StatusChip"
      ],
      "families": [
        "copy-comment:all",
        "same-name:StatusChip",
        "status-color-map:all"
      ],
      "file": "src/components/deals/StatusChip.tsx",
      "id": "src/components/deals/StatusChip.tsx#StatusChip",
      "importers": {
        "files": 0,
        "modules": []
      },
      "layer": "snowflake",
      "level": "atom",
      "levelReason": "wraps a single primitive",
      "line": 6,
      "loc": 3,
      "logic": "presentational",
      "module": "deals",
      "name": "StatusChip",
      "promotionCandidate": false,
      "quality": {
        "rawValues": 1,
        "themeValues": 0
      },
      "shared": false,
      "signals": {
        "data": false,
        "dataHooks": [],
        "domainProps": false,
        "pageArea": false,
        "primaryActions": 0,
        "region": false,
        "slots": 0,
        "styledTarget": null
      },
      "smells": [],
      "uses": [],
      "wraps": [
        "mui:Chip"
      ]
    },
    {
      "confidence": "high",
      "evidence": "CONFIRMED",
      "exportNames": [
        "LeadRow"
      ],
      "families": [
        "status-color-map:all"
      ],
      "file": "src/components/leads/LeadRow.tsx",
      "id": "src/components/leads/LeadRow.tsx#LeadRow",
      "importers": {
        "files": 1,
        "modules": [
          "leads"
        ]
      },
      "layer": "snowflake",
      "level": "molecule",
      "levelReason": "2+ atoms combined for one job",
      "line": 6,
      "loc": 8,
      "logic": "presentational",
      "module": "leads",
      "name": "LeadRow",
      "promotionCandidate": false,
      "quality": {
        "rawValues": 1,
        "themeValues": 2
      },
      "shared": false,
      "signals": {
        "data": false,
        "dataHooks": [],
        "domainProps": false,
        "pageArea": false,
        "primaryActions": 0,
        "region": false,
        "slots": 0,
        "styledTarget": null
      },
      "smells": [],
      "uses": [
        "src/common/components/status-tag.tsx#StatusTag"
      ],
      "wraps": [
        "mui:Box",
        "mui:Typography"
      ]
    },
    {
      "confidence": "high",
      "evidence": "CONFIRMED",
      "exportNames": [
        "LeadsPage"
      ],
      "families": [
        "repeated-style-block:e30c88a12898"
      ],
      "file": "src/components/leads/LeadsPage.tsx",
      "id": "src/components/leads/LeadsPage.tsx#LeadsPage",
      "importers": {
        "files": 1,
        "modules": []
      },
      "layer": "snowflake",
      "level": "page",
      "levelReason": "referenced as a route element",
      "line": 10,
      "loc": 15,
      "logic": "smart",
      "module": "leads",
      "name": "LeadsPage",
      "promotionCandidate": false,
      "quality": {
        "rawValues": 3,
        "themeValues": 2
      },
      "shared": false,
      "signals": {
        "data": true,
        "dataHooks": [
          "fetchLeads",
          "useQuery"
        ],
        "domainProps": false,
        "pageArea": true,
        "primaryActions": 0,
        "region": true,
        "slots": 0,
        "styledTarget": null
      },
      "smells": [],
      "uses": [